{"documents":[{"final_url":"https://www.kdata.or.kr/kr/contents/norms_01/view.do","projection":{"detected_format":"html","document_id":"doc-20c919f9ed00a1861c05219262274cfd08263dcd99db153b10a6eefad3c30264","extraction_confidence":94.0,"extraction_confidence_factors":[{"basis":"extension:html","code":"format_detection","value":0.8,"weight":0.3},{"basis":"units_with_text=1/units_total=1","code":"extraction_completeness","value":1.0,"weight":0.35},{"basis":"unicode-visible-character-ratio-and-length","code":"text_quality","value":1.0,"weight":0.2},{"basis":"matched=1/expected=1","code":"internal_term_match","value":1.0,"weight":0.15}],"extraction_status":"extracted","institution_id":"kdata","normalized_text_sha256":"6c425da5ce52594a5a6888f0e2157a66205887b2e7751c931a15c13b92fc33d3","parser_version":"0.1.0","projection_sha256":"fa5abf205995752a9c249557b8d263ed7a851f746429b8cda96b9fa734f84ba6","protection_status":"clear","publish_contract":"evidence-publish-document/1.0.0","source_id":"kdata-code-of-conduct","source_sha256":"20c919f9ed00a1861c05219262274cfd08263dcd99db153b10a6eefad3c30264","unit_count":480},"requested_url":"https://www.kdata.or.kr/kr/contents/norms_01/view.do"},{"final_url":"https://www.kdata.or.kr/kr/contents/open_02/view.do","projection":{"detected_format":"html","document_id":"doc-5967cb4879e5e9aecf1651eeb177cc65d924dbb37fd3f491c53d738725df82d8","extraction_confidence":94.0,"extraction_confidence_factors":[{"basis":"extension:html","code":"format_detection","value":0.8,"weight":0.3},{"basis":"units_with_text=1/units_total=1","code":"extraction_completeness","value":1.0,"weight":0.35},{"basis":"unicode-visible-character-ratio-and-length","code":"text_quality","value":1.0,"weight":0.2},{"basis":"matched=2/expected=2","code":"internal_term_match","value":1.0,"weight":0.15}],"extraction_status":"extracted","institution_id":"kdata","normalized_text_sha256":"9d34753578eca48f47a73e47b0a2ae717735065f22f2cda74e0f6047b0ca4ef9","parser_version":"0.1.0","projection_sha256":"f504187750699a502689d2250d0593b974760ec19f19b3c4fc7bc972bd90c8d5","protection_status":"clear","publish_contract":"evidence-publish-document/1.0.0","source_id":"kdata-information-disclosure-process","source_sha256":"5967cb4879e5e9aecf1651eeb177cc65d924dbb37fd3f491c53d738725df82d8","unit_count":231},"requested_url":"https://www.kdata.or.kr/kr/contents/open_02/view.do"},{"final_url":"https://www.kdata.or.kr/kr/contents/organ/view.do","projection":{"detected_format":"html","document_id":"doc-822f80c0a4641618f03601266d1655305435fb4710f6658772775798847d23e5","extraction_confidence":94.0,"extraction_confidence_factors":[{"basis":"extension:html","code":"format_detection","value":0.8,"weight":0.3},{"basis":"units_with_text=1/units_total=1","code":"extraction_completeness","value":1.0,"weight":0.35},{"basis":"unicode-visible-character-ratio-and-length","code":"text_quality","value":1.0,"weight":0.2},{"basis":"matched=2/expected=2","code":"internal_term_match","value":1.0,"weight":0.15}],"extraction_status":"extracted","institution_id":"kdata","normalized_text_sha256":"270133851c45892d33d9aa2fb008a57714d8d7babaaf4dbf6a8146bc6e71a7c5","parser_version":"0.1.0","projection_sha256":"9fa15e221d371377cfdf57c330e7862a0cc56224793686c65748ea9fc6260217","protection_status":"clear","publish_contract":"evidence-publish-document/1.0.0","source_id":"kdata-organization-current","source_sha256":"822f80c0a4641618f03601266d1655305435fb4710f6658772775798847d23e5","unit_count":366},"requested_url":"https://www.kdata.or.kr/kr/contents/organ/view.do"},{"final_url":"https://web.archive.org/web/20220705055818id_/https://kdata.or.kr/kr/contents/organ/view.do","projection":{"detected_format":"html","document_id":"doc-584cb84b59ea0f93ff309de260bb856d19554d18a8aed65e6b51dbe37a03fc6a","extraction_confidence":94.0,"extraction_confidence_factors":[{"basis":"extension:html","code":"format_detection","value":0.8,"weight":0.3},{"basis":"units_with_text=1/units_total=1","code":"extraction_completeness","value":1.0,"weight":0.35},{"basis":"unicode-visible-character-ratio-and-length","code":"text_quality","value":1.0,"weight":0.2},{"basis":"matched=3/expected=3","code":"internal_term_match","value":1.0,"weight":0.15}],"extraction_status":"extracted","institution_id":"kdata","normalized_text_sha256":"b8fb495b62c5243fa16ce8fe8842e1f63390939090965af0d4f144d2ac844f0a","parser_version":"0.1.0","projection_sha256":"b3ebd08a710200f8fb2a02954fa54305c9ddf3a8ee1f1988b145c7023e9cf6d6","protection_status":"clear","publish_contract":"evidence-publish-document/1.0.0","source_id":"kdata-organization-wayback-20220705055818","source_sha256":"584cb84b59ea0f93ff309de260bb856d19554d18a8aed65e6b51dbe37a03fc6a","unit_count":389},"requested_url":"https://web.archive.org/web/20220705055818id_/https://kdata.or.kr/kr/contents/organ/view.do"},{"final_url":"https://web.archive.org/web/20230306065437id_/https://kdata.or.kr/kr/contents/organ/view.do","projection":{"detected_format":"html","document_id":"doc-83a5bdbe5d3981d311daa8e4f50d1e6f947e620ed49fcd6a33bbe12b005156a4","extraction_confidence":94.0,"extraction_confidence_factors":[{"basis":"extension:html","code":"format_detection","value":0.8,"weight":0.3},{"basis":"units_with_text=1/units_total=1","code":"extraction_completeness","value":1.0,"weight":0.35},{"basis":"unicode-visible-character-ratio-and-length","code":"text_quality","value":1.0,"weight":0.2},{"basis":"matched=2/expected=2","code":"internal_term_match","value":1.0,"weight":0.15}],"extraction_status":"extracted","institution_id":"kdata","normalized_text_sha256":"733dbf72f39ad9fbca066f02fa5adc9ca5cc57b8f71d00c80691d40309ae00f8","parser_version":"0.1.0","projection_sha256":"9629146b36ec91ff3d615f29a02f5f02f931e55e4b3cff7c8236c522d2a34656","protection_status":"clear","publish_contract":"evidence-publish-document/1.0.0","source_id":"kdata-organization-wayback-20230306065437","source_sha256":"83a5bdbe5d3981d311daa8e4f50d1e6f947e620ed49fcd6a33bbe12b005156a4","unit_count":375},"requested_url":"https://web.archive.org/web/20230306065437id_/https://kdata.or.kr/kr/contents/organ/view.do"}],"failures":[],"institution_id":"kdata","snapshot_contract":"public-collection-snapshot/1.0.0","snapshot_date":"2026-09-25","snapshot_sha256":"c6f11d593212d58921da76bda44aeb1bc841f96f23fa20d2d7939f18b4c46fac"}
